{
  "$schema": "../../schemas/bake.schema.json",
  "id": "pain-brioche",
  "title": "Бриошный хлеб",
  "original": "Pain brioché",
  "kind": "pan",
  "description": "Формовой хлеб, родственный бриоши, но менее сдобный, — похож на халу. Во Франции его часто подают поджаренным к фуа-гра. Формула и режимы — по книге, двумя способами; печётся в открытой форме 2,36 л.",
  "tags": ["открытая форма", "pullman", "с яйцом"],
  "methods": [
    {
      "id": "preferment",
      "title": "С предферментом",
      "pan": { "name": "Форма Pullman без крышки", "volume": 2.36, "lid": false, "load": 240 },
      "time": { "total": 162, "note": "+ 4 ч созревания предфермента при 25 °C или 16 ч при +4 °C" },
      "formula": {
        "parts": [{ "id": "preferment", "name": "Предфермент" }],
        "ingredients": [
          { "name": "Мука", "grams": 300, "flour": true, "parts": { "preferment": 120 } },
          { "name": "Вода", "grams": 144, "parts": { "preferment": 82 }, "note": "в финальное тесто — холодная" },
          { "name": "Соль", "grams": 6, "parts": { "preferment": 2.4 } },
          { "name": "Сухие инстантные дрожжи", "grams": 3.5, "parts": { "preferment": 0.8 } },
          { "name": "Сахар", "grams": 45 },
          { "name": "Сухое молоко", "grams": 6 },
          { "name": "Солодовый экстракт", "grams": 1.5, "optional": true },
          { "name": "Жир", "grams": 24, "note": "безводный: растительный или маргарин" },
          { "name": "Яйца", "grams": 30 }
        ]
      },
      "stages": [
        {
          "title": "Предфермент",
          "steps": [
            { "text": "Смешайте ингредиенты предфермента на первой скорости.", "minutes": 3 },
            { "text": "Месите на второй скорости. Температура предфермента — 24 °C.", "minutes": 10, "temp": 24 },
            {
              "text": "Оставьте созревать на 4 часа при 25 °C или на 16 часов в холодильнике при +4 °C.",
              "minutes": 240,
              "temp": 25
            }
          ]
        },
        {
          "title": "Финальное тесто",
          "steps": [
            { "text": "Добавьте к предферменту остальные ингредиенты и смешайте на первой скорости.", "minutes": 4 },
            { "text": "Месите на второй скорости. Температура теста — 26 °C.", "minutes": 8, "temp": 26 },
            { "text": "Оставьте на первичное брожение.", "minutes": 30 },
            { "text": "Разделите тесто и дайте отлежаться.", "minutes": 20 },
            { "text": "Сформуйте заготовку и уложите в форму." }
          ]
        },
        {
          "title": "Расстойка и выпечка",
          "steps": [
            { "text": "Финальная расстойка — 70 минут; предположительно при 27 °C.", "minutes": 70, "temp": 27 },
            {
              "text": "Выпекайте при 220 °C 30 минут на нижней трети духовки, в режиме верх-низ.",
              "minutes": 30,
              "temp": 220
            },
            { "text": "Сразу выньте хлеб из формы и остудите на решётке 2–3 часа.", "minutes": 120, "minutesMax": 180 }
          ]
        }
      ]
    },
    {
      "id": "straight",
      "title": "Прямой",
      "pan": { "name": "Форма Pullman без крышки", "volume": 2.36, "lid": false, "load": 240 },
      "time": { "total": 168 },
      "formula": {
        "ingredients": [
          { "name": "Высококачественная пшеничная мука", "grams": 300, "flour": true },
          { "name": "Вода", "grams": 144 },
          { "name": "Соль", "grams": 6 },
          { "name": "Сухие инстантные дрожжи", "grams": 4 },
          { "name": "Сахар", "grams": 45 },
          { "name": "Сухое молоко", "grams": 6 },
          { "name": "Жир", "grams": 24, "note": "безводный: растительный или маргарин" },
          { "name": "Яйца", "grams": 30 }
        ]
      },
      "stages": [
        {
          "title": "Замес и брожение",
          "steps": [
            { "text": "Смешайте все ингредиенты на первой скорости.", "minutes": 3 },
            { "text": "Месите на второй скорости. Температура теста — 26 °C.", "minutes": 10, "temp": 26 },
            { "text": "Оставьте на первичное брожение.", "minutes": 45 },
            { "text": "Разделите тесто и дайте отлежаться.", "minutes": 20 },
            { "text": "Сформуйте заготовку и уложите в форму." }
          ]
        },
        {
          "title": "Расстойка и выпечка",
          "steps": [
            { "text": "Финальная расстойка — 60 минут; предположительно при 27 °C.", "minutes": 60, "temp": 27 },
            {
              "text": "Выпекайте при 220 °C 30 минут на нижней трети духовки, в режиме верх-низ.",
              "minutes": 30,
              "temp": 220
            },
            { "text": "Сразу выньте хлеб из формы и остудите на решётке 2–3 часа.", "minutes": 120, "minutesMax": 180 }
          ]
        }
      ]
    }
  ],
  "attempts": [
    {
      "title": "Попытка 1",
      "method": "preferment",
      "outcome": "issues",
      "notes": [
        "Тесто перегревалось при замесе даже на холодной воде — нужно охлаждать все ингредиенты.",
        "Возможно, тесто недомесили: расстойка шла долго и не до конца — только до половины формы."
      ]
    },
    {
      "title": "Попытка 2",
      "method": "straight",
      "outcome": "failed",
      "notes": [
        "Одной холодной воды мало, надо охлаждать и муку: замес по формуле, а тесто всё равно нагрелось до 27,5–28 °C.",
        "За 2 часа расстойки тесто не изменилось — хлеб не получился."
      ]
    }
  ],
  "tips": [
    "По французским нормам, которые приводит книга, в brioche-type bread должно быть не меньше 10 % яиц от веса муки.",
    "Жир обычно безводный — растительный или маргарин — с температурой плавления 32–33 °C зимой и 35–36 °C летом. Автор предпочитает естественно желтоватый растительный жир, например с пальмовым маслом, а не краситель: мякиш желтеет сам.",
    "Бриошный хлеб пекут в открытых формах из расчёта 230–240 г теста на литр объёма."
  ]
}
