{
  "$schema": "../../schemas/bake.schema.json",
  "id": "shokupan",
  "title": "Шокупан на юдане",
  "original": "食パン · Shokupan",
  "kind": "pan",
  "description": "Японский хлеб для завтраков и сэндвичей. Часть муки с вечера заваривают кипятком — это юдане: за ночь в холодильнике он становится похож на мягкий mochi, и мякиш выходит влажным, тонковолокнистым и дольше остаётся мягким.",
  "tags": ["форма с крышкой", "японский хлеб", "с вечера"],
  "result": "Если разломить хлеб руками, мякиш расходится длинными нежными волокнами: очень тонковолокнистый, эластичный, влажный и слегка жевательный, а не «ватный». Корка тонкая, мягкая, но не белая. Вкус умеренно сливочный и чуть сладкий — это всё ещё хлеб для завтрака и сэндвичей, а не булка.",
  "methods": [
    {
      "id": "main",
      "pan": { "name": "Форма Pullman с крышкой", "volume": 2.36, "lid": true, "load": 255 },
      "formula": {
        "parts": [{ "id": "yudane", "name": "Юдане" }],
        "ingredients": [
          { "name": "Сильная хлебная мука", "grams": 324, "flour": true, "parts": { "yudane": 65 }, "note": "12–13,5 % белка" },
          { "name": "Вода", "grams": 227, "parts": { "yudane": 65 }, "note": "для юдане — крутой кипяток" },
          { "name": "Сахар", "grams": 19.5 },
          { "name": "Соль", "grams": 6.5 },
          { "name": "Сухое обезжиренное молоко", "grams": 6.5 },
          { "name": "Несолёное сливочное масло", "grams": 16.2, "note": "мягкое, 18–22 °C" },
          { "name": "Сухие инстантные дрожжи", "grams": 3.2 }
        ]
      },
      "stages": [
        {
          "title": "Юдане — накануне вечером",
          "steps": [
            {
              "text": "Взвесьте 65 г муки в небольшой металлической миске. Доведите воду до кипения и сразу отмерьте 65 г."
            },
            {
              "text": "Вылейте кипяток на муку одним движением и очень быстро перемешайте жёсткой лопаткой 30–60 секунд.",
              "tip": "Получится не кашица, а плотная, липкая, неоднородная масса, похожая на очень мягкое тесто, — это нормально. Чтобы крахмал заварился, вода должна быть горячее ≈ 80 °C."
            },
            {
              "text": "Накройте плёнкой в контакт, дайте остыть и уберите в холодильник на 8–16 часов.",
              "minutes": 480,
              "minutesMax": 960,
              "tip": "За ночь масса станет однороднее и похожей на мягкий mochi."
            }
          ]
        },
        {
          "title": "Замес",
          "steps": [
            {
              "text": "Подготовьте всё заранее: масло должно быть мягким, примерно 18–22 °C, но не растопленным. Юдане можно брать холодным.",
              "temp": 18,
              "tempMax": 22
            },
            {
              "text": "Положите в чашу миксера муку, юдане, сухое молоко, сахар, дрожжи и воду; соль — сразу или через минуту. Смешивайте на низкой скорости, пока не останется сухой муки.",
              "minutes": 3,
              "tip": "Поначалу тесто будет грубым и липким."
            },
            {
              "text": "Остановите миксер: мука впитает воду, и клейковина дальше будет развиваться легче.",
              "minutes": 10,
              "minutesMax": 15
            },
            {
              "text": "Месите на средней скорости, пока тесто не начнёт собираться вокруг крюка, становиться эластичнее и очищать большую часть стенок чаши."
            },
            {
              "text": "Когда кусочек теста уже заметно эластичен, но ещё быстро рвётся, вводите масло в 3–4 приёма.",
              "tip": "После первой порции тесто почти наверняка снова станет размазанной липкой массой. Через несколько минут жир эмульгируется, и тесто соберётся."
            },
            {
              "text": "Доведите замес до полного windowpane: тесто гладкое, очень эластичное, слегка липкое, но не жидкое; маленький кусочек растягивается почти до прозрачной плёнки, а дырка при разрыве — с гладкими краями, без рваных зубцов.",
              "tip": "Это важнейшая часть рецепта: именно развитая клейковина даёт длинные волокна мякиша."
            },
            {
              "text": "Проверьте температуру теста: идеально 26–28 °C.",
              "temp": 26,
              "tempMax": 28,
              "tip": "Если уже 30–31 °C, прекратите замес даже при неидеальной плёнке — перегревать хуже. В следующий раз возьмите воду холоднее: Nippn советует подбирать её температуру по сезону, чтобы тесто было около 28 °C."
            }
          ]
        },
        {
          "title": "Брожение",
          "steps": [
            {
              "text": "Сформируйте гладкий шар, положите швом вниз в слегка смазанную ёмкость и накройте. Оставьте при 27–28 °C до увеличения в 2–2,5 раза.",
              "minutes": 60,
              "minutesMax": 90,
              "temp": 27,
              "tempMax": 28,
              "tip": "Время вторично: при 22 °C брожение займёт заметно дольше. Не ставьте тесто в духовку при 40–45 °C «чтобы быстрее» — масло размягчится, брожение станет слишком агрессивным, мякиш испортится."
            },
            {
              "text": "Проверьте тесто: присыпьте палец мукой и погрузите примерно на 2 см.",
              "tip": "Отверстие медленно и частично затягивается — готово. Мгновенно затягивается — рано. Тесто вокруг начинает опадать — передержали."
            }
          ]
        },
        {
          "title": "Деление и формовка",
          "steps": [
            {
              "text": "Выложите тесто на стол и аккуратно, но тщательно удалите самые крупные пузыри. Взвесьте и разделите ровно пополам — примерно по 300 г.",
              "tip": "Разница даже в 10–15 г будет заметна на готовой буханке."
            },
            {
              "text": "Подтяните каждый кусок в плотный шар, не разрывая поверхность. Накройте и оставьте отдохнуть.",
              "minutes": 15,
              "minutesMax": 20,
              "tip": "Сразу после деления клейковина напряжена: раскатать тесто не получится, оно будет сжиматься обратно."
            },
            {
              "text": "Положите кусок швом вверх, ладонью выпустите крупные пузыри и раскатайте в вертикальный овал. Загните левую треть к центру, правую — поверх: получится полоса шириной 6–7 см. Слегка раскатайте её вдоль.",
              "tip": "Тесто липкое: смазывайте руки маслом и слегка присыпайте стол мукой."
            },
            {
              "text": "Сверните полосу сверху в достаточно плотный рулет: не душите тесто, но и не оставляйте больших воздушных карманов между слоями. Хорошо защипните край."
            },
            {
              "text": "Так же сформуйте второй рулет. Очень тонко смажьте форму нейтральным жиром или маслом и уложите рулеты швом вниз, каждый в свою половину формы.",
              "tip": "Натяжение у обоих рулетов должно быть одинаковым, иначе одна половина хлеба поднимется выше другой."
            }
          ]
        },
        {
          "title": "Расстойка и выпечка",
          "steps": [
            {
              "text": "Расстаивайте в форме с крышкой примерно при 36 °C, желательно во влажной среде, — по высоте теста, а не по таймеру.",
              "temp": 36,
              "tip": "Под крышкой — до 1 см от верха формы в самой высокой точке (см. заметки о Pullman в справочнике)."
            },
            {
              "text": "Пока идёт расстойка, полностью прогрейте духовку до 210 °C без конвекции — минимум 25–30 минут.",
              "minutes": 25,
              "minutesMax": 30,
              "temp": 210
            },
            {
              "text": "Поставьте форму с закрытой крышкой, снизьте до 190 °C и выпекайте 30–35 минут.",
              "minutes": 30,
              "minutesMax": 35,
              "temp": 190,
              "tip": "С вентилятором ориентируйтесь примерно на 180 °C."
            },
            {
              "text": "Достаньте форму, один раз уверенно ударьте её дном о сложенное полотенце с высоты нескольких сантиметров и сразу выньте хлеб.",
              "tip": "Не оставляйте хлеб в форме «до остывания»: пар сконденсируется, стенки размокнут и могут втянуться внутрь."
            },
            {
              "text": "Остужайте на решётке минимум 2 часа. Не режьте горячим.",
              "minutes": 120,
              "tip": "Горячий, ещё не стабилизировавшийся мякиш сминается ножом в липкую полоску, и кажется, будто хлеб сырой."
            }
          ]
        }
      ]
    }
  ],
  "attempts": [
    {
      "outcome": "issues",
      "notes": [
        "Замес суммарно занял до 30 минут, а полного windowpane так и не получилось. Температура теста росла медленно.",
        "Хлеб поднялся только до половины формы."
      ]
    }
  ]
}
