{
  "$schema": "../../schemas/bake.schema.json",
  "id": "pizza-al-taglio",
  "title": "Пицца al taglio",
  "original": "Pizza al taglio",
  "kind": "pizza",
  "description": "Пицца в прямоугольных формах из теста с гидратацией 80 % и минимумом дрожжей. Тесто сутки-двое созревает в холодильнике, а печётся в Ooni Volt 12: сначала без начинки, потом с ней. Замес — на две формы 30 × 23 см.",
  "tags": ["холодная ферментация", "печь для пиццы"],
  "methods": [
    {
      "id": "main",
      "pan": { "name": "Форма Agnelli", "count": 2, "size": "30 × 23 см" },
      "formula": {
        "parts": [{ "id": "autolyse", "name": "Автолиз" }],
        "ingredients": [
          { "name": "Мука", "grams": 575, "flour": true, "parts": { "autolyse": 575 }, "note": "сила W 280–320" },
          { "name": "Вода", "grams": 460, "parts": { "autolyse": 410 }, "note": "50 г вливают уже по ходу замеса" },
          { "name": "Соль", "grams": 14 },
          { "name": "Сухие дрожжи", "grams": 1.2 },
          { "name": "Оливковое масло", "grams": 12 }
        ]
      },
      "stages": [
        {
          "title": "День 1 · замес",
          "steps": [
            {
              "text": "Смешайте всю муку (575 г) с 410 г воды и оставьте на автолиз.",
              "minutes": 30
            },
            {
              "text": "Добавьте 1,2 г дрожжей и начните замес. По ходу замеса постепенно влейте оставшиеся 50 г воды."
            },
            {
              "text": "Когда тесто станет гладким, добавьте 14 г соли, затем 12 г масла и месите ещё 5–8 минут. Температура теста после замеса — желательно 23–25 °C.",
              "minutes": 5,
              "minutesMax": 8,
              "temp": 23,
              "tempMax": 25
            }
          ]
        },
        {
          "title": "День 1 · складывания",
          "steps": [
            { "text": "Через 30 минут сделайте первое складывание.", "minutes": 30 },
            { "text": "Ещё через 30 минут — второе складывание.", "minutes": 30 },
            { "text": "Ещё через 30 минут — третье складывание.", "minutes": 30 },
            {
              "text": "Уберите тесто в холодильник на 24–48 часов.",
              "minutes": 1440,
              "minutesMax": 2880,
              "tip": "Лучше на все 48 часов."
            }
          ]
        },
        {
          "title": "День выпечки",
          "steps": [
            { "text": "Достаньте тесто из холодильника и оставьте на столе на 2 часа.", "minutes": 120 },
            {
              "text": "Хорошо смажьте формы оливковым маслом — не жалейте, примерно 1–1,5 ст. л. на форму."
            },
            {
              "text": "Разделите тесто пополам, примерно по 530 г, и переложите в формы. Через 15–20 минут оно расслабится.",
              "minutes": 15,
              "minutesMax": 20,
              "tip": "В заметке не сказано, когда делить тесто. Можно и до холодильника — сразу на две части в отдельных контейнерах."
            },
            {
              "text": "Аккуратно растяните тесто пальцами до углов. Если сопротивляется — подождите ещё 15 минут и повторите."
            },
            {
              "text": "Оставьте на финальную расстойку на 1,5–2 часа: в тесте должно появиться много пузырей.",
              "minutes": 90,
              "minutesMax": 120
            }
          ]
        },
        {
          "title": "Выпечка в Ooni Volt 12",
          "steps": [
            {
              "text": "Разогрейте печь до 300–350 °C — не меньше 30 минут.",
              "minutes": 30,
              "temp": 300,
              "tempMax": 350
            },
            {
              "text": "Сделайте нижний нагрев немного сильнее верхнего: металлическая форма замедляет подрумянивание дна."
            },
            { "text": "Выпекайте без начинки около 6–8 минут.", "minutes": 6, "minutesMax": 8 },
            {
              "text": "Когда тесто поднялось и начало румяниться, выложите начинку и допекайте ещё 2–4 минуты — пока сыр не расплавится, а края не станут золотистыми.",
              "minutes": 2,
              "minutesMax": 4
            }
          ]
        }
      ]
    }
  ],
  "variations": {
    "title": "Начинки",
    "items": [
      { "name": "Margherita", "text": "Томат, моцарелла, базилик." },
      { "name": "Patate e rosmarino", "text": "Картофель, розмарин, масло, соль." },
      { "name": "Salsiccia e patate", "text": "Итальянская колбаса и картофель." },
      { "name": "Funghi e salsiccia", "text": "Грибы, колбаса, моцарелла." },
      { "name": "Zucchine e mozzarella", "text": "Цукини и моцарелла." },
      { "name": "Prosciutto e funghi", "text": "Ветчина и грибы." },
      { "name": "Quattro formaggi", "text": "Смесь четырёх сыров." },
      { "name": "Tonno e cipolla", "text": "Тунец и красный лук." },
      { "name": "Melanzane e parmigiano", "text": "Баклажан, томат, пармезан." },
      { "name": "Mortadella, stracciatella e pistacchio", "text": "Кладут в основном после выпечки." },
      { "name": "Prosciutto crudo e burrata", "text": "Прошутто и буррата — после выпечки." },
      { "name": "Rossa", "text": "Только томат, масло и орегано." },
      { "name": "Bianca", "text": "Масло, соль, иногда розмарин — без томата и сыра." }
    ]
  }
}
