{
  "$schema": "../../schemas/bake.schema.json",
  "id": "sandwich-bread",
  "title": "Сэндвичный хлеб",
  "original": "Sandwich bread",
  "kind": "pan",
  "description": "Белый формовой хлеб для сэндвичей в форме Pullman 2,36 л с крышкой. Формула и режимы — по книге, двумя способами: с предферментом, который созревает 5 часов в тепле или ночь в холодильнике, и прямым — с жидким молоком вместо сухого.",
  "tags": ["форма с крышкой", "pullman"],
  "methods": [
    {
      "id": "preferment",
      "title": "С предферментом",
      "pan": { "name": "Форма Pullman с крышкой", "volume": 2.36, "lid": true, "load": 240 },
      "time": { "total": 162, "note": "+ 5 ч созревания предфермента при 24 °C или 15 ч при +5 °C" },
      "formula": {
        "parts": [{ "id": "preferment", "name": "Предфермент" }],
        "ingredients": [
          { "name": "Пшеничная мука", "grams": 320, "flour": true, "parts": { "preferment": 160 } },
          { "name": "Вода", "grams": 199, "parts": { "preferment": 109 } },
          { "name": "Соль", "grams": 6.4, "parts": { "preferment": 3.2 } },
          { "name": "Сухие инстантные дрожжи", "grams": 4.3, "parts": { "preferment": 1.1 } },
          { "name": "Сахар", "grams": 9.6 },
          { "name": "Жир", "grams": 14.4 },
          { "name": "Сухое молоко", "grams": 4.8 },
          { "name": "Солодовый экстракт", "grams": 1.6, "optional": true }
        ]
      },
      "stages": [
        {
          "title": "Предфермент",
          "steps": [
            { "text": "Смешайте ингредиенты предфермента на первой скорости.", "minutes": 3 },
            { "text": "Месите на второй скорости. Температура предфермента — 24 °C.", "minutes": 6, "temp": 24 },
            {
              "text": "Оставьте созревать на 5 часов при 24 °C или на 15 часов в холодильнике при +5 °C.",
              "minutes": 300,
              "temp": 24
            }
          ]
        },
        {
          "title": "Финальное тесто",
          "steps": [
            { "text": "Добавьте к предферменту остальные ингредиенты и смешайте на первой скорости.", "minutes": 4 },
            { "text": "Месите на второй скорости. Температура теста — 27 °C.", "minutes": 8, "temp": 27 },
            { "text": "Оставьте на первичное брожение.", "minutes": 25 },
            {
              "text": "Разделите тесто и дайте отлежаться.",
              "minutes": 25,
              "tip": "Способы формовки Pullman — в справочнике раздела «Выпечка»."
            },
            { "text": "Сформуйте заготовку и уложите в форму." }
          ]
        },
        {
          "title": "Расстойка и выпечка",
          "steps": [
            {
              "text": "Финальная расстойка — 50–60 минут, по необходимости; предположительно при 27 °C.",
              "minutes": 50,
              "minutesMax": 60,
              "temp": 27,
              "tip": "Под крышкой — до 1 см от верха формы в самой высокой точке."
            },
            {
              "text": "Закройте крышку и выпекайте при 225 °C 35–40 минут на нижней трети духовки, в режиме верх-низ.",
              "minutes": 35,
              "minutesMax": 40,
              "temp": 225
            },
            { "text": "Сразу выньте хлеб из формы и остудите на решётке 2–3 часа.", "minutes": 120, "minutesMax": 180 }
          ]
        }
      ]
    },
    {
      "id": "straight",
      "title": "Прямой",
      "pan": { "name": "Форма Pullman с крышкой", "volume": 2.36, "lid": true, "load": 230 },
      "time": { "total": 172 },
      "formula": {
        "ingredients": [
          { "name": "Пшеничная мука", "grams": 320, "flour": true },
          { "name": "Вода", "grams": 112 },
          { "name": "Молоко", "grams": 80, "note": "пастеризованное" },
          { "name": "Соль", "grams": 6.4 },
          { "name": "Сухие инстантные дрожжи", "grams": 4.3 },
          { "name": "Сахар", "grams": 11.2 },
          { "name": "Жир", "grams": 14.4 },
          { "name": "Солодовый экстракт", "grams": 1, "optional": true }
        ]
      },
      "stages": [
        {
          "title": "Замес и брожение",
          "steps": [
            { "text": "Смешайте все ингредиенты на первой скорости.", "minutes": 4 },
            { "text": "Месите на второй скорости. Температура теста — 27 °C.", "minutes": 8, "temp": 27 },
            { "text": "Оставьте на первичное брожение.", "minutes": 35 },
            {
              "text": "Разделите тесто и дайте отлежаться.",
              "minutes": 25,
              "tip": "Способы формовки Pullman — в справочнике раздела «Выпечка»."
            },
            { "text": "Сформуйте заготовку и уложите в форму." }
          ]
        },
        {
          "title": "Расстойка и выпечка",
          "steps": [
            {
              "text": "Финальная расстойка — 50–60 минут; предположительно при 27 °C.",
              "minutes": 50,
              "minutesMax": 60,
              "temp": 27,
              "tip": "На практике прямое тесто расстаивалось на 30 минут дольше, чем с предферментом, — 80–90 минут. Под крышкой — до 1 см от верха формы."
            },
            {
              "text": "Закройте крышку и выпекайте при 225 °C 35–40 минут на нижней трети духовки, в режиме верх-низ.",
              "minutes": 35,
              "minutesMax": 40,
              "temp": 225
            },
            { "text": "Сразу выньте хлеб из формы и остудите на решётке 2–3 часа.", "minutes": 120, "minutesMax": 180 }
          ]
        }
      ]
    }
  ],
  "attempts": [
    {
      "outcome": "issues",
      "notes": ["Корка резиновая. На следующий день немного лучше, а после тостера — заметно лучше."]
    },
    {
      "method": "straight",
      "outcome": "issues",
      "notes": ["Расстойка шла на 30 минут дольше, чем с предферментом, — 80–90 минут: у прямого теста ниже ферментативная активность."]
    }
  ]
}
